{
  "$schema": "http://json-schema.org/draft-04/schema#",
  "type": "object",
  "properties": {
    "id": {
      "type": "string"
    },
    "name": {
      "type": "string"
    },
    "code": {
      "type": "string"
    },
    "isActive": {
      "type": "boolean"
    },
    "institutionId": {
      "type": "string",
      "pattern": "^[a-fA-F0-9]{8}-[a-fA-F0-9]{4}-[a-fA-F0-9]{4}-[a-fA-F0-9]{4}-[a-fA-F0-9]{12}$"
    },
    "campusId": {
      "type": "string",
      "pattern": "^[a-fA-F0-9]{8}-[a-fA-F0-9]{4}-[a-fA-F0-9]{4}-[a-fA-F0-9]{4}-[a-fA-F0-9]{12}$"
    },
    "libraryId": {
      "type": "string",
      "pattern": "^[a-fA-F0-9]{8}-[a-fA-F0-9]{4}-[a-fA-F0-9]{4}-[a-fA-F0-9]{4}-[a-fA-F0-9]{12}$"
    },
    "details": {
      "type": "object"
    },
    "metadata": {
      "type": "object",
      "$ref": "raml-util/schemas/metadata.schema",
      "readonly": true
    }
  },
  "additionalProperties": false,
  "required": [
    "name",
    "code",
    "institutionId",
    "campusId",
    "libraryId"
  ]
}
