{
  "id": "53cf956f-c1df-410b-8bea-27f712cca7c0",
  "name": "Assorted Stacks",
  "code": "UU/OC/SL/A",
  "isActive": true,
  "institutionId": "6e068e4c-46e1-4cc5-8fcc-b9785dffb421",
  "campusId": "d9c58c68-da66-481d-9d90-78441970c8b6",
  "libraryId": "b77c9e17-65c6-41f7-9f42-e48e9b3b7783",
  "details": {
    "foo": "bar"
  }
}
