{
  "id": "fcd64ce1-6995-48f0-840e-89ffa2288371",
  "name": "Dusty Stacks",
  "code": "UU/OC/SL/D",
  "isActive": true,
  "institutionId": "6e068e4c-46e1-4cc5-8fcc-b9785dffb421",
  "campusId": "d9c58c68-da66-481d-9d90-78441970c8b6",
  "libraryId": "b77c9e17-65c6-41f7-9f42-e48e9b3b7783",
  "details": {
    "a": "b",
    "foo": "bar"
  }
}
